[
  {
    "id": "001-sample1",
    "input": "tests/001-sample1.in",
    "expected": "tests/001-sample1.out",
    "points": 5,
    "tags": [
      "sample"
    ],
    "compare": {
      "mode": "tokens"
    }
  },
  {
    "id": "002-sample2",
    "input": "tests/002-sample2.in",
    "expected": "tests/002-sample2.out",
    "points": 5,
    "tags": [
      "sample"
    ],
    "compare": {
      "mode": "tokens"
    }
  },
  {
    "id": "003-single-positive",
    "input": "tests/003-single-positive.in",
    "expected": "tests/003-single-positive.out",
    "points": 5,
    "tags": [
      "boundary"
    ],
    "compare": {
      "mode": "tokens"
    }
  },
  {
    "id": "004-single-negative",
    "input": "tests/004-single-negative.in",
    "expected": "tests/004-single-negative.out",
    "points": 5,
    "tags": [
      "boundary"
    ],
    "compare": {
      "mode": "tokens"
    }
  },
  {
    "id": "005-two-nodes-both-pos",
    "input": "tests/005-two-nodes-both-pos.in",
    "expected": "tests/005-two-nodes-both-pos.out",
    "points": 5,
    "tags": [
      "boundary"
    ],
    "compare": {
      "mode": "tokens"
    }
  },
  {
    "id": "006-two-nodes-pos-neg",
    "input": "tests/006-two-nodes-pos-neg.in",
    "expected": "tests/006-two-nodes-pos-neg.out",
    "points": 5,
    "tags": [
      "boundary"
    ],
    "compare": {
      "mode": "tokens"
    }
  },
  {
    "id": "007-all-neg-3-nodes",
    "input": "tests/007-all-neg-3-nodes.in",
    "expected": "tests/007-all-neg-3-nodes.out",
    "points": 5,
    "tags": [
      "trick"
    ],
    "compare": {
      "mode": "tokens"
    }
  },
  {
    "id": "008-all-neg-cbt",
    "input": "tests/008-all-neg-cbt.in",
    "expected": "tests/008-all-neg-cbt.out",
    "points": 5,
    "tags": [
      "trick"
    ],
    "compare": {
      "mode": "tokens"
    }
  },
  {
    "id": "009-all-neg-skewed",
    "input": "tests/009-all-neg-skewed.in",
    "expected": "tests/009-all-neg-skewed.out",
    "points": 5,
    "tags": [
      "trick"
    ],
    "compare": {
      "mode": "tokens"
    }
  },
  {
    "id": "010-root-neg-children-pos",
    "input": "tests/010-root-neg-children-pos.in",
    "expected": "tests/010-root-neg-children-pos.out",
    "points": 5,
    "tags": [
      "trick"
    ],
    "compare": {
      "mode": "tokens"
    }
  },
  {
    "id": "011-left-huge-pos-right-neg",
    "input": "tests/011-left-huge-pos-right-neg.in",
    "expected": "tests/011-left-huge-pos-right-neg.out",
    "points": 5,
    "tags": [
      "trick"
    ],
    "compare": {
      "mode": "tokens"
    }
  },
  {
    "id": "012-path-not-through-root",
    "input": "tests/012-path-not-through-root.in",
    "expected": "tests/012-path-not-through-root.out",
    "points": 5,
    "tags": [
      "trick"
    ],
    "compare": {
      "mode": "tokens"
    }
  },
  {
    "id": "013-skewed-left-pos",
    "input": "tests/013-skewed-left-pos.in",
    "expected": "tests/013-skewed-left-pos.out",
    "points": 5,
    "tags": [
      "skewed"
    ],
    "compare": {
      "mode": "tokens"
    }
  },
  {
    "id": "014-skewed-right-pos",
    "input": "tests/014-skewed-right-pos.in",
    "expected": "tests/014-skewed-right-pos.out",
    "points": 5,
    "tags": [
      "skewed"
    ],
    "compare": {
      "mode": "tokens"
    }
  },
  {
    "id": "015-zigzag-ladder",
    "input": "tests/015-zigzag-ladder.in",
    "expected": "tests/015-zigzag-ladder.out",
    "points": 5,
    "tags": [
      "structure"
    ],
    "compare": {
      "mode": "tokens"
    }
  },
  {
    "id": "016-perfect-tree-7",
    "input": "tests/016-perfect-tree-7.in",
    "expected": "tests/016-perfect-tree-7.out",
    "points": 5,
    "tags": [
      "normal"
    ],
    "compare": {
      "mode": "tokens"
    }
  },
  {
    "id": "017-perfect-tree-7-mixed",
    "input": "tests/017-perfect-tree-7-mixed.in",
    "expected": "tests/017-perfect-tree-7-mixed.out",
    "points": 5,
    "tags": [
      "normal"
    ],
    "compare": {
      "mode": "tokens"
    }
  },
  {
    "id": "018-perfect-tree-15-mixed",
    "input": "tests/018-perfect-tree-15-mixed.in",
    "expected": "tests/018-perfect-tree-15-mixed.out",
    "points": 5,
    "tags": [
      "normal"
    ],
    "compare": {
      "mode": "tokens"
    }
  },
  {
    "id": "019-cbt-31-pos",
    "input": "tests/019-cbt-31-pos.in",
    "expected": "tests/019-cbt-31-pos.out",
    "points": 5,
    "tags": [
      "normal"
    ],
    "compare": {
      "mode": "tokens"
    }
  },
  {
    "id": "020-stress-cbt-63-mixed",
    "input": "tests/020-stress-cbt-63-mixed.in",
    "expected": "tests/020-stress-cbt-63-mixed.out",
    "points": 5,
    "tags": [
      "stress",
      "scale"
    ],
    "compare": {
      "mode": "tokens"
    }
  }
]
