[
  {
    "id": "001-sample",
    "input": "tests/001-sample.in",
    "expected": "tests/001-sample.out",
    "points": 20,
    "tags": ["sample"]
  },
  {
    "id": "002-even-length",
    "input": "tests/002-even-length.in",
    "expected": "tests/002-even-length.out",
    "points": 15,
    "tags": ["normal"]
  },
  {
    "id": "003-single-element",
    "input": "tests/003-single-element.in",
    "expected": "tests/003-single-element.out",
    "points": 10,
    "tags": ["boundary"]
  },
  {
    "id": "004-empty",
    "input": "tests/004-empty.in",
    "expected": "tests/004-empty.out",
    "points": 10,
    "tags": ["boundary"]
  },
  {
    "id": "005-stress-1e4",
    "input": "tests/005-stress-1e4.in",
    "expected": "tests/005-stress-1e4.out",
    "points": 30,
    "tags": ["stress"],
    "timeMs": 2000
  },
  {
    "id": "006-normal-mixed",
    "input": "tests/006-normal-mixed.in",
    "expected": "tests/006-normal-mixed.out",
    "points": 15,
    "tags": ["normal"]
  }
]
