[
  {
    "id": "001-sample",
    "input": "tests/001-sample.in",
    "expected": "tests/001-sample.out",
    "points": 20,
    "tags": ["sample"]
  },
  {
    "id": "002-single-vertex",
    "input": "tests/002-single-vertex.in",
    "expected": "tests/002-single-vertex.out",
    "points": 10,
    "tags": ["boundary"]
  },
  {
    "id": "003-disconnected",
    "input": "tests/003-disconnected.in",
    "expected": "tests/003-disconnected.out",
    "points": 15,
    "tags": ["boundary"]
  },
  {
    "id": "004-chain",
    "input": "tests/004-chain.in",
    "expected": "tests/004-chain.out",
    "points": 15,
    "tags": ["normal"]
  },
  {
    "id": "005-star",
    "input": "tests/005-star.in",
    "expected": "tests/005-star.out",
    "points": 15,
    "tags": ["normal"]
  },
  {
    "id": "006-cycle",
    "input": "tests/006-cycle.in",
    "expected": "tests/006-cycle.out",
    "points": 15,
    "tags": ["normal"]
  },
  {
    "id": "007-stress",
    "input": "tests/007-stress.in",
    "expected": "tests/007-stress.out",
    "points": 10,
    "tags": ["stress"]
  }
]
