[
  {
    "id": "001-sample",
    "input": "tests/001-sample.in",
    "expected": "tests/001-sample.out",
    "points": 5,
    "tags": [
      "sample"
    ]
  },
  {
    "id": "002-singleton",
    "input": "tests/002-singleton.in",
    "expected": "tests/002-singleton.out",
    "points": 5,
    "tags": [
      "boundary"
    ]
  },
  {
    "id": "003-no-edges",
    "input": "tests/003-no-edges.in",
    "expected": "tests/003-no-edges.out",
    "points": 5,
    "tags": [
      "boundary"
    ]
  },
  {
    "id": "004-diamond",
    "input": "tests/004-diamond.in",
    "expected": "tests/004-diamond.out",
    "points": 5,
    "tags": [
      "regression"
    ]
  },
  {
    "id": "005-new-small-ready-vertex",
    "input": "tests/005-new-small-ready-vertex.in",
    "expected": "tests/005-new-small-ready-vertex.out",
    "points": 5,
    "tags": [
      "regression"
    ]
  },
  {
    "id": "006-disconnected",
    "input": "tests/006-disconnected.in",
    "expected": "tests/006-disconnected.out",
    "points": 5,
    "tags": [
      "boundary"
    ]
  },
  {
    "id": "007-many-sources",
    "input": "tests/007-many-sources.in",
    "expected": "tests/007-many-sources.out",
    "points": 5,
    "tags": [
      "normal"
    ]
  },
  {
    "id": "008-many-sinks",
    "input": "tests/008-many-sinks.in",
    "expected": "tests/008-many-sinks.out",
    "points": 5,
    "tags": [
      "normal"
    ]
  },
  {
    "id": "009-non-numeric-topological-order",
    "input": "tests/009-non-numeric-topological-order.in",
    "expected": "tests/009-non-numeric-topological-order.out",
    "points": 5,
    "tags": [
      "regression"
    ]
  },
  {
    "id": "010-two-components-different-length",
    "input": "tests/010-two-components-different-length.in",
    "expected": "tests/010-two-components-different-length.out",
    "points": 5,
    "tags": [
      "regression"
    ]
  },
  {
    "id": "011-shortcut-does-not-dominate",
    "input": "tests/011-shortcut-does-not-dominate.in",
    "expected": "tests/011-shortcut-does-not-dominate.out",
    "points": 5,
    "tags": [
      "regression"
    ]
  },
  {
    "id": "012-isolated-is-a-chain",
    "input": "tests/012-isolated-is-a-chain.in",
    "expected": "tests/012-isolated-is-a-chain.out",
    "points": 5,
    "tags": [
      "regression"
    ]
  },
  {
    "id": "013-seeded-dag-0",
    "input": "tests/013-seeded-dag-0.in",
    "expected": "tests/013-seeded-dag-0.out",
    "points": 5,
    "tags": [
      "normal"
    ]
  },
  {
    "id": "014-seeded-dag-1",
    "input": "tests/014-seeded-dag-1.in",
    "expected": "tests/014-seeded-dag-1.out",
    "points": 5,
    "tags": [
      "normal"
    ]
  },
  {
    "id": "015-seeded-dag-2",
    "input": "tests/015-seeded-dag-2.in",
    "expected": "tests/015-seeded-dag-2.out",
    "points": 5,
    "tags": [
      "normal"
    ]
  },
  {
    "id": "016-seeded-dag-3",
    "input": "tests/016-seeded-dag-3.in",
    "expected": "tests/016-seeded-dag-3.out",
    "points": 5,
    "tags": [
      "normal"
    ]
  },
  {
    "id": "017-seeded-dag-4",
    "input": "tests/017-seeded-dag-4.in",
    "expected": "tests/017-seeded-dag-4.out",
    "points": 5,
    "tags": [
      "normal"
    ]
  },
  {
    "id": "018-long-chain",
    "input": "tests/018-long-chain.in",
    "expected": "tests/018-long-chain.out",
    "points": 5,
    "tags": [
      "stress"
    ]
  },
  {
    "id": "019-layered-many-paths",
    "input": "tests/019-layered-many-paths.in",
    "expected": "tests/019-layered-many-paths.out",
    "points": 5,
    "tags": [
      "stress"
    ]
  },
  {
    "id": "020-dense-dag",
    "input": "tests/020-dense-dag.in",
    "expected": "tests/020-dense-dag.out",
    "points": 5,
    "tags": [
      "stress"
    ]
  }
]
