[
  {
    "id": "001-sample",
    "input": "tests/001-sample.in",
    "expected": "tests/001-sample.out",
    "points": 5,
    "tags": [
      "sample"
    ],
    "compare": {
      "mode": "exact"
    }
  },
  {
    "id": "002-odd-length",
    "input": "tests/002-odd-length.in",
    "expected": "tests/002-odd-length.out",
    "points": 5,
    "tags": [
      "boundary"
    ]
  },
  {
    "id": "003-empty",
    "input": "tests/003-empty.in",
    "expected": "tests/003-empty.out",
    "points": 5,
    "tags": [
      "boundary"
    ]
  },
  {
    "id": "004-single",
    "input": "tests/004-single.in",
    "expected": "tests/004-single.out",
    "points": 5,
    "tags": [
      "boundary"
    ]
  },
  {
    "id": "005-two-nodes",
    "input": "tests/005-two-nodes.in",
    "expected": "tests/005-two-nodes.out",
    "points": 5,
    "tags": [
      "boundary"
    ]
  },
  {
    "id": "006-three-nodes",
    "input": "tests/006-three-nodes.in",
    "expected": "tests/006-three-nodes.out",
    "points": 5,
    "tags": [
      "boundary"
    ]
  },
  {
    "id": "007-four-nodes",
    "input": "tests/007-four-nodes.in",
    "expected": "tests/007-four-nodes.out",
    "points": 5,
    "tags": [
      "normal"
    ]
  },
  {
    "id": "008-five-nodes",
    "input": "tests/008-five-nodes.in",
    "expected": "tests/008-five-nodes.out",
    "points": 5,
    "tags": [
      "normal"
    ]
  },
  {
    "id": "009-duplicates",
    "input": "tests/009-duplicates.in",
    "expected": "tests/009-duplicates.out",
    "points": 5,
    "tags": [
      "special",
      "duplicates"
    ]
  },
  {
    "id": "010-negative-values",
    "input": "tests/010-negative-values.in",
    "expected": "tests/010-negative-values.out",
    "points": 5,
    "tags": [
      "normal"
    ]
  },
  {
    "id": "011-min-max-values",
    "input": "tests/011-min-max-values.in",
    "expected": "tests/011-min-max-values.out",
    "points": 5,
    "tags": [
      "boundary",
      "special"
    ]
  },
  {
    "id": "012-all-equal",
    "input": "tests/012-all-equal.in",
    "expected": "tests/012-all-equal.out",
    "points": 5,
    "tags": [
      "special",
      "duplicates"
    ]
  },
  {
    "id": "013-alternating-signs",
    "input": "tests/013-alternating-signs.in",
    "expected": "tests/013-alternating-signs.out",
    "points": 5,
    "tags": [
      "normal"
    ]
  },
  {
    "id": "014-ascending",
    "input": "tests/014-ascending.in",
    "expected": "tests/014-ascending.out",
    "points": 5,
    "tags": [
      "normal"
    ]
  },
  {
    "id": "015-descending",
    "input": "tests/015-descending.in",
    "expected": "tests/015-descending.out",
    "points": 5,
    "tags": [
      "normal"
    ]
  },
  {
    "id": "016-medium-odd",
    "input": "tests/016-medium-odd.in",
    "expected": "tests/016-medium-odd.out",
    "points": 5,
    "tags": [
      "normal"
    ]
  },
  {
    "id": "017-medium-even",
    "input": "tests/017-medium-even.in",
    "expected": "tests/017-medium-even.out",
    "points": 5,
    "tags": [
      "normal"
    ]
  },
  {
    "id": "018-medium-repeated",
    "input": "tests/018-medium-repeated.in",
    "expected": "tests/018-medium-repeated.out",
    "points": 5,
    "tags": [
      "normal",
      "duplicates"
    ]
  },
  {
    "id": "019-stress-odd",
    "input": "tests/019-stress-odd.in",
    "expected": "tests/019-stress-odd.out",
    "points": 5,
    "tags": [
      "stress",
      "complexity"
    ]
  },
  {
    "id": "020-stress-even",
    "input": "tests/020-stress-even.in",
    "expected": "tests/020-stress-even.out",
    "points": 5,
    "tags": [
      "stress",
      "complexity"
    ]
  }
]
