[
  {
    "id": "001-sample1",
    "input": "tests/001-sample1.in",
    "expected": "tests/001-sample1.out",
    "points": 20,
    "tags": [
      "sample"
    ],
    "compare": {
      "mode": "tokens"
    }
  },
  {
    "id": "002-sample2",
    "input": "tests/002-sample2.in",
    "expected": "tests/002-sample2.out",
    "points": 20,
    "tags": [
      "normal"
    ],
    "compare": {
      "mode": "tokens"
    }
  },
  {
    "id": "003-root-child",
    "input": "tests/003-root-child.in",
    "expected": "tests/003-root-child.out",
    "points": 20,
    "tags": [
      "boundary"
    ],
    "compare": {
      "mode": "tokens"
    }
  },
  {
    "id": "004-deep-leaf",
    "input": "tests/004-deep-leaf.in",
    "expected": "tests/004-deep-leaf.out",
    "points": 20,
    "tags": [
      "normal"
    ],
    "compare": {
      "mode": "tokens"
    }
  },
  {
    "id": "005-skewed",
    "input": "tests/005-skewed.in",
    "expected": "tests/005-skewed.out",
    "points": 20,
    "tags": [
      "boundary"
    ],
    "compare": {
      "mode": "tokens"
    }
  }
]
